,activityID,startTime,sourceLocation,activeRegionNum,instruments,cmeAnalyses,linkedEvents,note,catalog
908,2017-04-01T22:12:00-CME-001,2017-04-01 22:12:00,"[13, -54]",12644.0,"['SOHO: LASCO/C2', 'SOHO: LASCO/C3', 'STEREO A: SECCHI/COR2']","[{'time21_5': '2017-04-02T03:14Z', 'latitude': 20.0, 'longitude': 54.0, 'halfAngle': 21.0, 'speed': 609.0, 'type': 'C', 'isMostAccurate': True, 'note': 'Lat/Lon taken from a measurement only using STA Cor2 frames because it appeared as a partial halo in STA and was trouble to fit to both with the half width staying realistic. Other parameters from a fit to both in which the half-width for STA was cut smaller to get a realistic fit on C3.', 'levelOfData': 0, 'enlilList': [{'modelCompletionTime': '2017-04-02T14:17Z', 'au': 2.0, 'estimatedShockArrivalTime': None, 'estimatedDuration': None, 'rmin_re': None, 'kp_18': None, 'kp_90': None, 'kp_135': None, 'kp_180': None, 'isEarthGB': False, 'impactList': None, 'cmeIDs': ['2017-04-01T22:12:00-CME-001']}, {'modelCompletionTime': '2017-04-04T16:04Z', 'au': 2.0, 'estimatedShockArrivalTime': None, 'estimatedDuration': None, 'rmin_re': None, 'kp_18': None, 'kp_90': None, 'kp_135': None, 'kp_180': None, 'isEarthGB': False, 'impactList': None, 'cmeIDs': ['2017-04-01T22:12:00-CME-001', '2017-04-02T09:09:00-CME-001', '2017-04-02T20:09:00-CME-001', '2017-04-03T01:48:00-CME-001', '2017-04-03T15:36:00-CME-001']}]}]",1,Source was large eruption from AR 2644 (N12W49) accompanied by M4.4 class flare.,SWRC_CATALOG
909,2017-04-02T09:09:00-CME-001,2017-04-02 09:09:00,"[12, -56]",12644.0,"['STEREO A: SECCHI/COR2', 'SOHO: LASCO/C2', 'SOHO: LASCO/C3']","[{'time21_5': '2017-04-02T17:54Z', 'latitude': 15.0, 'longitude': 65.0, 'halfAngle': 17.0, 'speed': 438.0, 'type': 'S', 'isMostAccurate': True, 'note': '', 'levelOfData': 0, 'enlilList': [{'modelCompletionTime': '2017-04-04T16:04Z', 'au': 2.0, 'estimatedShockArrivalTime': None, 'estimatedDuration': None, 'rmin_re': None, 'kp_18': None, 'kp_90': None, 'kp_135': None, 'kp_180': None, 'isEarthGB': False, 'impactList': None, 'cmeIDs': ['2017-04-01T22:12:00-CME-001', '2017-04-02T09:09:00-CME-001', '2017-04-02T20:09:00-CME-001', '2017-04-03T01:48:00-CME-001', '2017-04-03T15:36:00-CME-001']}]}, {'time21_5': '2017-04-02T13:34Z', 'latitude': 12.0, 'longitude': 66.0, 'halfAngle': 25.0, 'speed': 655.0, 'type': 'C', 'isMostAccurate': False, 'note': 'These are preliminary measurements taken using STEREO A only.', 'levelOfData': 0, 'enlilList': None}]",1,"Start time needs to be changed when C2 images come in. Source was an M5.3 flare accompanied by fast, spewing material and rising loops in SDO AIA 171.",SWRC_CATALOG
910,2017-04-02T20:09:00-CME-001,2017-04-02 20:09:00,"[15, -60]",12644.0,"['STEREO A: SECCHI/COR2', 'SOHO: LASCO/C2', 'SOHO: LASCO/C3']","[{'time21_5': '2017-04-03T01:59Z', 'latitude': 9.0, 'longitude': 63.0, 'halfAngle': 30.0, 'speed': 538.0, 'type': 'C', 'isMostAccurate': True, 'note': '', 'levelOfData': 0, 'enlilList': [{'modelCompletionTime': '2017-04-03T23:25Z', 'au': 2.0, 'estimatedShockArrivalTime': None, 'estimatedDuration': None, 'rmin_re': None, 'kp_18': None, 'kp_90': None, 'kp_135': None, 'kp_180': None, 'isEarthGB': False, 'impactList': None, 'cmeIDs': ['2017-04-02T20:09:00-CME-001']}, {'modelCompletionTime': '2017-04-04T16:04Z', 'au': 2.0, 'estimatedShockArrivalTime': None, 'estimatedDuration': None, 'rmin_re': None, 'kp_18': None, 'kp_90': None, 'kp_135': None, 'kp_180': None, 'isEarthGB': False, 'impactList': None, 'cmeIDs': ['2017-04-01T22:12:00-CME-001', '2017-04-02T09:09:00-CME-001', '2017-04-02T20:09:00-CME-001', '2017-04-03T01:48:00-CME-001', '2017-04-03T15:36:00-CME-001']}]}, {'time21_5': '2017-04-03T03:26Z', 'latitude': 5.0, 'longitude': 63.0, 'halfAngle': 29.0, 'speed': 389.0, 'type': 'S', 'isMostAccurate': False, 'note': 'These are preliminary measurements taken using STA cor2 and limited C3 imagery only.', 'levelOfData': 0, 'enlilList': None}]",1,Source is an M2.1 flare and associated eruption characterized by opening field lines in SDO AIA 193 around 18:38.,SWRC_CATALOG
911,2017-04-03T01:48:00-CME-001,2017-04-03 01:48:00,,,"['SOHO: LASCO/C2', 'SOHO: LASCO/C3', 'STEREO A: SECCHI/COR2']","[{'time21_5': '2017-04-03T04:34Z', 'latitude': 13.0, 'longitude': 61.0, 'halfAngle': 19.0, 'speed': 298.0, 'type': 'S', 'isMostAccurate': True, 'note': '', 'levelOfData': 1, 'enlilList': [{'modelCompletionTime': '2017-04-04T16:04Z', 'au': 2.0, 'estimatedShockArrivalTime': None, 'estimatedDuration': None, 'rmin_re': None, 'kp_18': None, 'kp_90': None, 'kp_135': None, 'kp_180': None, 'isEarthGB': False, 'impactList': None, 'cmeIDs': ['2017-04-01T22:12:00-CME-001', '2017-04-02T09:09:00-CME-001', '2017-04-02T20:09:00-CME-001', '2017-04-03T01:48:00-CME-001', '2017-04-03T15:36:00-CME-001']}]}, {'time21_5': '2017-04-03T14:34Z', 'latitude': 13.0, 'longitude': 61.0, 'halfAngle': 19.0, 'speed': 298.0, 'type': 'S', 'isMostAccurate': False, 'note': '', 'levelOfData': 0, 'enlilList': None}]",1,"This CME is associated with a M1.2 class flare and eruption, with the flare peaking at 01:05.",SWRC_CATALOG
912,2017-04-03T15:36:00-CME-001,2017-04-03 15:36:00,"[16, -78]",12644.0,"['SOHO: LASCO/C2', 'SOHO: LASCO/C3', 'STEREO A: SECCHI/COR2']","[{'time21_5': '2017-04-03T21:38Z', 'latitude': 18.0, 'longitude': 75.0, 'halfAngle': 12.0, 'speed': 516.0, 'type': 'C', 'isMostAccurate': True, 'note': 'These are the same measurements as the initial measurement, with the half width adjusted for accuracy.', 'levelOfData': 0, 'enlilList': [{'modelCompletionTime': '2017-04-04T16:04Z', 'au': 2.0, 'estimatedShockArrivalTime': None, 'estimatedDuration': None, 'rmin_re': None, 'kp_18': None, 'kp_90': None, 'kp_135': None, 'kp_180': None, 'isEarthGB': False, 'impactList': None, 'cmeIDs': ['2017-04-01T22:12:00-CME-001', '2017-04-02T09:09:00-CME-001', '2017-04-02T20:09:00-CME-001', '2017-04-03T01:48:00-CME-001', '2017-04-03T15:36:00-CME-001']}]}, {'time21_5': '2017-04-03T21:38Z', 'latitude': 18.0, 'longitude': 75.0, 'halfAngle': 27.0, 'speed': 516.0, 'type': 'C', 'isMostAccurate': False, 'note': '', 'levelOfData': 0, 'enlilList': None}]",1,"Associated with M5.8 class flare which peaked at 2017-04-03T14:29Z also from AR 2644. Eruption visible in SDO AIA 193, 171 and 304.",SWRC_CATALOG
913,2017-04-04T07:00:00-CME-001,2017-04-04 07:00:00,,12644.0,"['SOHO: LASCO/C2', 'SOHO: LASCO/C3', 'STEREO A: SECCHI/COR2']","[{'time21_5': '2017-04-04T18:29Z', 'latitude': 22.0, 'longitude': 90.0, 'halfAngle': 10.0, 'speed': 386.0, 'type': 'S', 'isMostAccurate': True, 'note': 'Only measured using STA Cor2 because the chronograph stick blocks the CME in C3.', 'levelOfData': 0, 'enlilList': None}]",0,Source is some field line movement seen to the NW in 171 from the still active AR2644.,SWRC_CATALOG
914,2017-04-04T09:24:00-CME-001,2017-04-04 09:24:00,,12644.0,"['SOHO: LASCO/C2', 'SOHO: LASCO/C3', 'STEREO A: SECCHI/COR2']","[{'time21_5': '2017-04-04T16:59Z', 'latitude': 15.0, 'longitude': 95.0, 'halfAngle': 34.0, 'speed': 449.0, 'type': 'S', 'isMostAccurate': True, 'note': 'CME was faint in the Cor2 difference images and could not be seen clearly so it was measured with only C3.', 'levelOfData': 0, 'enlilList': None}]",0,Source is the same AR2644 that has been active.  Moving field lines and minor flaring can be seen around 6:24 in 171.,SWRC_CATALOG
915,2017-04-04T12:00:00-CME-001,2017-04-04 12:00:00,,12644.0,"['SOHO: LASCO/C2', 'SOHO: LASCO/C3', 'STEREO A: SECCHI/COR2']","[{'time21_5': '2017-04-05T09:57Z', 'latitude': 26.0, 'longitude': 99.0, 'halfAngle': 13.0, 'speed': 125.0, 'type': 'S', 'isMostAccurate': True, 'note': 'Used only C3 because CME was not clearly defined in Cor2.', 'levelOfData': 0, 'enlilList': None}]",0,Narrow and faint compared to the previous CMEs from this AR. Starting around 04-04T10:12Z there was a lot of narrow material seen escaping with minor flares.,SWRC_CATALOG
916,2017-04-04T17:24:00-CME-001,2017-04-04 17:24:00,,12644.0,"['SOHO: LASCO/C2', 'SOHO: LASCO/C3', 'STEREO A: SECCHI/COR2']","[{'time21_5': '2017-04-05T07:21Z', 'latitude': 22.0, 'longitude': 95.0, 'halfAngle': 27.0, 'speed': 258.0, 'type': 'S', 'isMostAccurate': True, 'note': ""Measured using C2 and STA Cor2 because the CME wasn't clearly defined in C3."", 'levelOfData': 0, 'enlilList': None}]",0,"The AR has been mildly active for a long time, CME could be from a C2.3 flare starting around 04-04T13:41Z.",SWRC_CATALOG
917,2017-04-04T21:36:00-CME-001,2017-04-04 21:36:00,,12644.0,"['SOHO: LASCO/C2', 'SOHO: LASCO/C3', 'STEREO A: SECCHI/COR2']","[{'time21_5': '2017-04-06T10:41Z', 'latitude': 28.0, 'longitude': 100.0, 'halfAngle': 13.0, 'speed': 90.0, 'type': 'S', 'isMostAccurate': True, 'note': 'Measured using C2 because could not see well in C3 or Cor2.  Measurement may be too slow.', 'levelOfData': 0, 'enlilList': None}]",0,From same AR.,SWRC_CATALOG
918,2017-04-05T02:24:00-CME-001,2017-04-05 02:24:00,,,"['SOHO: LASCO/C2', 'SOHO: LASCO/C3', 'STEREO A: SECCHI/COR2']","[{'time21_5': '2017-04-05T14:06Z', 'latitude': -15.0, 'longitude': -31.0, 'halfAngle': 19.0, 'speed': 384.0, 'type': 'S', 'isMostAccurate': True, 'note': 'Measurement taken with C2 and C3 frames. Fit is still imperfect, likely due to unknown source.', 'levelOfData': 0, 'enlilList': None}, {'time21_5': '2017-04-05T12:07Z', 'latitude': -12.0, 'longitude': -24.0, 'halfAngle': 16.0, 'speed': 391.0, 'type': 'S', 'isMostAccurate': False, 'note': 'This is a preliminary measurement using mostly C2 frames with a few C3 frames.', 'levelOfData': 0, 'enlilList': None}]",0,Not sure about source.,SWRC_CATALOG
919,2017-04-05T16:00:00-CME-001,2017-04-05 16:00:00,"[-55, 139]",,"['SOHO: LASCO/C2', 'SOHO: LASCO/C3', 'STEREO A: SECCHI/COR2']","[{'time21_5': '2017-04-06T14:07Z', 'latitude': -55.0, 'longitude': -140.0, 'halfAngle': 45.0, 'speed': 135.0, 'type': 'S', 'isMostAccurate': True, 'note': 'This is a very unreliable analysis since this is a faint CME and might actually be a series of two CMEs. Source location, even though it is very visible, is very wide as the source is a liftoff of a very long filament, stretching along latitude. Longitude especially is very unclear.', 'levelOfData': 0, 'enlilList': None}]",0,"Starting around 15:00 on the back side in EUVI STA there are signs of significant filament eruption on the southern side of the STA-facing EUVI 19, high rising loops from 15:00 through the rest of the day. This eruption really ""eats"" into the mostly southern CH seen in STA AUVI.",SWRC_CATALOG
920,2017-04-06T16:24:00-CME-001,2017-04-06 16:24:00,,,['STEREO A: SECCHI/COR2'],"[{'time21_5': '2017-04-07T02:47Z', 'latitude': 15.0, 'longitude': 128.0, 'halfAngle': 25.0, 'speed': 311.0, 'type': 'S', 'isMostAccurate': True, 'note': 'Measured using C2 and STA Cor2 (not visible in C3).', 'levelOfData': 0, 'enlilList': None}, {'time21_5': '2017-04-07T04:59Z', 'latitude': 16.0, 'longitude': 91.0, 'halfAngle': 21.0, 'speed': 281.0, 'type': 'S', 'isMostAccurate': False, 'note': 'Measurement completed using STA Cor2 data', 'levelOfData': 0, 'enlilList': None}]",0,"Source is not entirely clear due to a 15-hour data gap in SDO imagery, but activity can be seen off the eastern limb of STA EUVI in the form of rising loops starting around 14:30.",SWRC_CATALOG
921,2017-04-09T17:36:00-CME-001,2017-04-09 17:36:00,"[10, -110]",12644.0,"['SOHO: LASCO/C2', 'SOHO: LASCO/C3', 'STEREO A: SECCHI/COR2']","[{'time21_5': '2017-04-10T23:00Z', 'latitude': 10.0, 'longitude': 109.0, 'halfAngle': 21.0, 'speed': 127.0, 'type': 'S', 'isMostAccurate': True, 'note': 'Measured with C2 in swpc_cat. Too faint in C3 and STA.', 'levelOfData': 0, 'enlilList': None}]",0,"Source is likely an eruption from AR 2644 which just rotated beyond the west limb and is visible in STA EUVI imagery. No distinct eruptive signature preceding CME, but lats of activity and flaring throughout the day.",SWRC_CATALOG
922,2017-04-10T00:24:00-CME-001,2017-04-10 00:24:00,"[30, 30]",,"['STEREO A: SECCHI/COR2', 'SOHO: LASCO/C2', 'SOHO: LASCO/C3']","[{'time21_5': '2017-04-10T13:42Z', 'latitude': -11.0, 'longitude': -37.0, 'halfAngle': 21.0, 'speed': 278.0, 'type': 'S', 'isMostAccurate': True, 'note': '', 'levelOfData': 1, 'enlilList': [{'modelCompletionTime': '2017-04-11T19:01Z', 'au': 2.0, 'estimatedShockArrivalTime': '2017-04-14T18:00Z', 'estimatedDuration': None, 'rmin_re': None, 'kp_18': None, 'kp_90': None, 'kp_135': None, 'kp_180': None, 'isEarthGB': True, 'impactList': None, 'cmeIDs': ['2017-04-10T00:24:00-CME-001']}]}, {'time21_5': '2017-04-10T12:43Z', 'latitude': -13.0, 'longitude': -27.0, 'halfAngle': 17.0, 'speed': 317.0, 'type': 'S', 'isMostAccurate': False, 'note': 'Measured with C3 and Cor2 in swpc_cat.', 'levelOfData': 0, 'enlilList': None}]",0,Likely source is the filament seen lifting off in SDO 193 from about 2017-04-09T20:00 - 00:00.,SWRC_CATALOG
923,2017-04-10T12:39:00-CME-001,2017-04-10 12:39:00,"[10, 170]",12644.0,['STEREO A: SECCHI/COR2'],"[{'time21_5': '2017-04-10T19:47Z', 'latitude': 14.0, 'longitude': -173.0, 'halfAngle': 24.0, 'speed': 433.0, 'type': 'S', 'isMostAccurate': True, 'note': '', 'levelOfData': 0, 'enlilList': None}]",0,"Source is likely former active region 2644 that is now far-sided which has been flaring throughout the day. Visible as a partial halo in the North of C2, too faint to be visible in C3.",SWRC_CATALOG
924,2017-04-10T19:09:00-CME-001,2017-04-10 19:09:00,,,"['STEREO A: SECCHI/COR2', 'SOHO: LASCO/C2']","[{'time21_5': '2017-04-11T01:33Z', 'latitude': 11.0, 'longitude': -168.0, 'halfAngle': 22.0, 'speed': 445.0, 'type': 'S', 'isMostAccurate': True, 'note': 'This is a poor measurement due to the STA Cor2 data gap 04-10T19:24-22:24.  The CME can only be seen in Cor2 and there are only 2 frames before the gap and one after where the CME is visible.', 'levelOfData': 0, 'enlilList': None}]",0,This is a poor measurement due to the STA Cor2 data gap 04-10T19:24Z-22:24Z. The CME can only be seen in Cor2 and there are only 2 frames before the gap and one after where the CME is visible.  First visible to the NE in STA at 19:09Z and as a faint partial halo in C2 (not visible in C3) caused by activity from AR 2644 in the NE of STA EUVI 195.,SWRC_CATALOG
925,2017-04-10T23:09:00-CME-001,2017-04-10 23:09:00,,,['STEREO A: SECCHI/COR2'],"[{'time21_5': '2017-04-11T06:06Z', 'latitude': 14.0, 'longitude': -169.0, 'halfAngle': 45.0, 'speed': 483.0, 'type': 'S', 'isMostAccurate': True, 'note': 'Measured using Cor2.', 'levelOfData': 0, 'enlilList': [{'modelCompletionTime': '2017-04-11T19:34Z', 'au': 2.0, 'estimatedShockArrivalTime': None, 'estimatedDuration': None, 'rmin_re': None, 'kp_18': None, 'kp_90': None, 'kp_135': None, 'kp_180': None, 'isEarthGB': False, 'impactList': [{'isGlancingBlow': False, 'location': 'STEREO A', 'arrivalTime': '2017-04-13T19:46Z'}], 'cmeIDs': ['2017-04-10T23:09:00-CME-001']}]}]",0,"Source is far-sided. The ARs to the NE there have been active and they seem to have had an eruption between 19:25-22:15, but there is a EUVI data gap, so pinpointing the eruption start time is difficult.",SWRC_CATALOG
926,2017-04-11T00:18:00-CME-001,2017-04-11 00:18:00,,,"['SOHO: LASCO/C2', 'SOHO: LASCO/C3']","[{'time21_5': '2017-04-11T07:37Z', 'latitude': 42.0, 'longitude': -64.0, 'halfAngle': 41.0, 'speed': 440.0, 'type': 'S', 'isMostAccurate': True, 'note': 'Measured using C3.', 'levelOfData': 0, 'enlilList': None}]",0,Source seems to be a filament eruption at 04-10T18:21 in the NE (seen in 193).,SWRC_CATALOG
927,2017-04-11T11:24:00-CME-001,2017-04-11 11:24:00,,,"['STEREO A: SECCHI/COR2', 'SOHO: LASCO/C2', 'SOHO: LASCO/C3']","[{'time21_5': '2017-04-11T16:26Z', 'latitude': 23.0, 'longitude': 146.0, 'halfAngle': 11.0, 'speed': 693.0, 'type': 'C', 'isMostAccurate': True, 'note': '', 'levelOfData': 0, 'enlilList': None}]",0,The source is an eruption from the NE AR near the limb in STA EUVI 195 around 10:25.,SWRC_CATALOG
928,2017-04-12T13:26:00-CME-001,2017-04-12 13:26:00,,,"['SOHO: LASCO/C2', 'SOHO: LASCO/C3']","[{'time21_5': '2017-04-12T17:42Z', 'latitude': 6.0, 'longitude': -149.0, 'halfAngle': 35.0, 'speed': 661.0, 'type': 'C', 'isMostAccurate': True, 'note': '', 'levelOfData': 0, 'enlilList': [{'modelCompletionTime': '2017-04-12T23:07Z', 'au': 2.0, 'estimatedShockArrivalTime': None, 'estimatedDuration': None, 'rmin_re': None, 'kp_18': None, 'kp_90': None, 'kp_135': None, 'kp_180': None, 'isEarthGB': False, 'impactList': [{'isGlancingBlow': False, 'location': 'Mars', 'arrivalTime': '2017-04-16T08:25Z'}, {'isGlancingBlow': False, 'location': 'STEREO A', 'arrivalTime': '2017-04-14T19:47Z'}, {'isGlancingBlow': True, 'location': 'Spitzer', 'arrivalTime': '2017-04-16T10:00Z'}], 'cmeIDs': ['2017-04-12T13:26:00-CME-001']}]}, {'time21_5': '2017-04-12T20:42Z', 'latitude': 19.0, 'longitude': -55.0, 'halfAngle': 20.0, 'speed': 434.0, 'type': 'S', 'isMostAccurate': False, 'note': '', 'levelOfData': 0, 'enlilList': None}]",0,Source is far-sided eruption from N10E20 that was triggered by a clearly visible flare in EUVI 195 at 12:15.,SWRC_CATALOG
929,2017-04-13T17:54:00-CME-001,2017-04-13 17:54:00,,,"['STEREO A: SECCHI/COR2', 'SOHO: LASCO/C3']","[{'time21_5': '2017-04-14T02:38Z', 'latitude': 4.0, 'longitude': 136.0, 'halfAngle': 22.0, 'speed': 412.0, 'type': 'S', 'isMostAccurate': True, 'note': '', 'levelOfData': 0, 'enlilList': [{'modelCompletionTime': '2017-04-14T14:40Z', 'au': 2.0, 'estimatedShockArrivalTime': None, 'estimatedDuration': None, 'rmin_re': None, 'kp_18': None, 'kp_90': None, 'kp_135': None, 'kp_180': None, 'isEarthGB': False, 'impactList': [{'isGlancingBlow': True, 'location': 'STEREO B', 'arrivalTime': '2017-04-17T12:00Z'}], 'cmeIDs': ['2017-04-13T17:54:00-CME-001']}]}, {'time21_5': '2017-04-13T22:51Z', 'latitude': 3.0, 'longitude': -168.0, 'halfAngle': 15.0, 'speed': 589.0, 'type': 'C', 'isMostAccurate': False, 'note': '', 'levelOfData': 0, 'enlilList': None}]",0,"Source is far-sided ARs that have been producing eruptive activity throughout the day, center disk and east of center.",SWRC_CATALOG
930,2017-04-15T02:09:00-CME-001,2017-04-15 02:09:00,,,['STEREO A: SECCHI/COR2'],"[{'time21_5': '2017-04-15T11:18Z', 'latitude': 16.0, 'longitude': -3.0, 'halfAngle': 15.0, 'speed': 302.0, 'type': 'S', 'isMostAccurate': True, 'note': '', 'levelOfData': 0, 'enlilList': None}]",0,Source is the eruption showing dimming to the NE of AR 2650 (N20E05) beginning around 23:26.,SWRC_CATALOG
931,2017-04-16T06:12:00-CME-001,2017-04-16 06:12:00,,,"['SOHO: LASCO/C2', 'SOHO: LASCO/C3', 'STEREO A: SECCHI/COR2']","[{'time21_5': '2017-04-16T10:19Z', 'latitude': -4.0, 'longitude': -100.0, 'halfAngle': 10.0, 'speed': 493.0, 'type': 'S', 'isMostAccurate': True, 'note': '', 'levelOfData': 0, 'enlilList': None}]",0,"Source difficult to determine, but nearest culprit is some very quick movement in the outside edges of the field lines off the eastern limb visible in SDO AIA 171/193 around 06:01Z.",SWRC_CATALOG
932,2017-04-18T10:00:00-CME-001,2017-04-18 10:00:00,,,"['SOHO: LASCO/C2', 'SOHO: LASCO/C3', 'STEREO A: SECCHI/COR2']","[{'time21_5': '2017-04-18T16:23Z', 'latitude': -3.0, 'longitude': -78.0, 'halfAngle': 16.0, 'speed': 512.0, 'type': 'C', 'isMostAccurate': True, 'note': 'Measured using C3 and STA Cor2.\n\nPossible glancing blow at Spitzer for 04-21T12:00Z, but the CME may have dissipated before then.', 'levelOfData': 0, 'enlilList': [{'modelCompletionTime': '2017-04-18T18:46Z', 'au': 2.0, 'estimatedShockArrivalTime': None, 'estimatedDuration': None, 'rmin_re': None, 'kp_18': None, 'kp_90': None, 'kp_135': None, 'kp_180': None, 'isEarthGB': False, 'impactList': [{'isGlancingBlow': True, 'location': 'Spitzer', 'arrivalTime': '2017-04-21T12:00Z'}], 'cmeIDs': ['2017-04-18T10:00:00-CME-001']}]}, {'time21_5': '2017-04-18T16:19Z', 'latitude': -9.0, 'longitude': -80.0, 'halfAngle': 17.0, 'speed': 565.0, 'type': 'C', 'isMostAccurate': False, 'note': 'These are preliminary measurements taken using limited LASCO C3 imagery and STA cor2 imagery.', 'levelOfData': 0, 'enlilList': None}]",1,"The source is an eruption seen south of the active regions on the east limb of SDO AIA 193 at 09:30, also seen in STA EUVI on the west limb and south of the active regions.",SWRC_CATALOG
933,2017-04-18T19:48:00-CME-001,2017-04-18 19:48:00,,,"['SOHO: LASCO/C2', 'SOHO: LASCO/C3', 'STEREO A: SECCHI/COR2']","[{'time21_5': '2017-04-18T23:42Z', 'latitude': 21.0, 'longitude': -76.0, 'halfAngle': 50.0, 'speed': 934.0, 'type': 'C', 'isMostAccurate': True, 'note': 'Measured using only C3 due to STA data gap from 19:39-22:09.', 'levelOfData': 0, 'enlilList': [{'modelCompletionTime': '2017-04-19T13:17Z', 'au': 2.0, 'estimatedShockArrivalTime': None, 'estimatedDuration': None, 'rmin_re': None, 'kp_18': None, 'kp_90': None, 'kp_135': None, 'kp_180': None, 'isEarthGB': False, 'impactList': [{'isGlancingBlow': False, 'location': 'Spitzer', 'arrivalTime': '2017-04-21T02:26Z'}, {'isGlancingBlow': True, 'location': 'Mars', 'arrivalTime': '2017-04-23T18:00Z'}, {'isGlancingBlow': True, 'location': 'STEREO A', 'arrivalTime': '2017-04-21T20:00Z'}], 'cmeIDs': ['2017-04-18T19:48:00-CME-001']}, {'modelCompletionTime': '2017-04-19T15:04Z', 'au': 5.5, 'estimatedShockArrivalTime': None, 'estimatedDuration': None, 'rmin_re': None, 'kp_18': None, 'kp_90': None, 'kp_135': None, 'kp_180': None, 'isEarthGB': False, 'impactList': [{'isGlancingBlow': False, 'location': 'Spitzer', 'arrivalTime': '2017-04-21T02:25Z'}, {'isGlancingBlow': True, 'location': 'Mars', 'arrivalTime': '2017-04-23T18:00Z'}, {'isGlancingBlow': True, 'location': 'STEREO A', 'arrivalTime': '2017-04-21T20:00Z'}], 'cmeIDs': ['2017-04-18T19:48:00-CME-001']}]}]",1,Caused by the C5.5 flare and associated events.,SWRC_CATALOG
934,2017-04-20T16:48:00-CME-001,2017-04-20 16:48:00,,12651.0,['SOHO: LASCO/C2'],"[{'time21_5': '2017-04-21T01:24Z', 'latitude': 0.0, 'longitude': -87.0, 'halfAngle': 27.0, 'speed': 454.0, 'type': 'S', 'isMostAccurate': True, 'note': 'Measured using only C2 frames.', 'levelOfData': 0, 'enlilList': None}]",0,Faint CME with a streamer-like portion preceding the loop structure. Source is likely material seen leaving AR2651 in SDO AIA 193 and 171 starting at 16:09. Also visible in STA EUVI near the NW limb.,SWRC_CATALOG
935,2017-04-20T22:09:00-CME-001,2017-04-20 22:09:00,,,"['STEREO A: SECCHI/COR2', 'SOHO: LASCO/C3']","[{'time21_5': '2017-04-21T02:47Z', 'latitude': 34.0, 'longitude': -10.0, 'halfAngle': 34.0, 'speed': 719.0, 'type': 'C', 'isMostAccurate': True, 'note': '', 'levelOfData': 1, 'enlilList': [{'modelCompletionTime': '2017-04-21T14:39Z', 'au': 2.0, 'estimatedShockArrivalTime': '2017-04-23T13:00Z', 'estimatedDuration': None, 'rmin_re': None, 'kp_18': None, 'kp_90': 3, 'kp_135': 4, 'kp_180': 5, 'isEarthGB': True, 'impactList': None, 'cmeIDs': ['2017-04-20T22:09:00-CME-001']}]}, {'time21_5': '2017-04-21T02:47Z', 'latitude': 34.0, 'longitude': -10.0, 'halfAngle': 23.0, 'speed': 719.0, 'type': 'C', 'isMostAccurate': False, 'note': '', 'levelOfData': 0, 'enlilList': None}]",0,Caused by a filament eruption centered around N20E20 visible in SDO AIA 193 and 304 starting around 20:30.,SWRC_CATALOG
936,2017-04-20T22:30:00-CME-001,2017-04-20 22:30:00,,,"['SOHO: LASCO/C3', 'STEREO A: SECCHI/COR2']","[{'time21_5': '2017-04-21T07:26Z', 'latitude': 16.0, 'longitude': 78.0, 'halfAngle': 16.0, 'speed': 364.0, 'type': 'S', 'isMostAccurate': True, 'note': '', 'levelOfData': 0, 'enlilList': None}]",0,"Caused by a filament lift-off near the NW limb in SDO AIA 171, 193 and 304, beginning around 19:15",SWRC_CATALOG
937,2017-04-23T06:00:00-CME-001,2017-04-23 06:00:00,,,"['SOHO: LASCO/C2', 'SOHO: LASCO/C3', 'STEREO A: SECCHI/COR2']","[{'time21_5': '2017-04-23T09:33Z', 'latitude': -3.0, 'longitude': -66.0, 'halfAngle': 23.0, 'speed': 911.0, 'type': 'C', 'isMostAccurate': True, 'note': '', 'levelOfData': 0, 'enlilList': [{'modelCompletionTime': '2017-04-23T15:42Z', 'au': 2.0, 'estimatedShockArrivalTime': None, 'estimatedDuration': None, 'rmin_re': None, 'kp_18': None, 'kp_90': None, 'kp_135': None, 'kp_180': None, 'isEarthGB': False, 'impactList': [{'isGlancingBlow': True, 'location': 'Spitzer', 'arrivalTime': '2017-04-27T06:00Z'}], 'cmeIDs': ['2017-04-23T06:00:00-CME-001']}]}]",0,Source is an eruption visible in AIA 171/193 around N15E45 beginning at 05:41.,SWRC_CATALOG
938,2017-04-24T03:12:00-CME-001,2017-04-24 03:12:00,"[40, 40]",,"['SOHO: LASCO/C2', 'SOHO: LASCO/C3', 'STEREO A: SECCHI/COR2']","[{'time21_5': '2017-04-24T15:02Z', 'latitude': 43.0, 'longitude': -45.0, 'halfAngle': 51.0, 'speed': 358.0, 'type': 'S', 'isMostAccurate': True, 'note': 'Difficult to measure, with a streamer-like portion preceding the more defined CME structure. Measured with swpc_cat using C2 and Cor2.', 'levelOfData': 0, 'enlilList': [{'modelCompletionTime': '2017-04-24T20:03Z', 'au': 2.0, 'estimatedShockArrivalTime': None, 'estimatedDuration': None, 'rmin_re': None, 'kp_18': None, 'kp_90': None, 'kp_135': None, 'kp_180': None, 'isEarthGB': False, 'impactList': None, 'cmeIDs': ['2017-04-24T03:12:00-CME-001']}]}, {'time21_5': '2017-04-24T09:33Z', 'latitude': 43.0, 'longitude': -45.0, 'halfAngle': 51.0, 'speed': 358.0, 'type': 'S', 'isMostAccurate': False, 'note': '', 'levelOfData': 1, 'enlilList': None}]",0,"Source is large filament eruption visible in the NE of SDO AIA 171, 193, and 304 starting at 2017-04-23T23:55Z.",SWRC_CATALOG
