,activityID,startTime,sourceLocation,activeRegionNum,instruments,cmeAnalyses,linkedEvents,note,catalog
288,2015-07-09T22:36:00-CME-001,2015-07-09 22:36:00,,,"['SOHO: LASCO/C2', 'SOHO: LASCO/C3']","[{'time21_5': '2015-07-10T10:14Z', 'latitude': -47.0, 'longitude': -60.0, 'halfAngle': 32.0, 'speed': 450.0, 'type': 'S', 'isMostAccurate': True, 'note': 'Eastern part of CME was fit with SWPC_cat (C3 only), lon quite uncertain, can be between -60 and -90\n(or sightly behind the limb), considering the large extent of the source filament this is no surprise.', 'levelOfData': 0, 'enlilList': None}]",0,"filament eruption close the south pole, filament starts to slowly rise at ~ 14.00 UT (seen in AIA 304), C2 streamer to the SE also start to slowly rise, fast rise phase in AIA starts around 20:00, C2 starts fast rise ~22.36 (which was chosen as start time of CME). The filament is very exended in longitude spanning probably half the sun, faint dimming off the SE limb (in AIA 193) seems to be connected with it, implying that the eastern end of the fil is behind the limb. The western part of the fil (in 304) rises but mostly drains away to the west limb. Post-eruptive loops appear in AIA 193, sequentially from E limb to the west. CME in C3 is very asymmetric, mostly the eastern part was fit.",SWRC_CATALOG
289,2015-07-10T16:00:00-CME-001,2015-07-10 16:00:00,,,"['SOHO: LASCO/C2', 'SOHO: LASCO/C3']","[{'time21_5': '2015-07-12T00:29Z', 'latitude': 47.0, 'longitude': 104.0, 'halfAngle': 34.0, 'speed': 116.0, 'type': 'S', 'isMostAccurate': True, 'note': '', 'levelOfData': 0, 'enlilList': None}]",0,Appears to be associated with a filament eruption from the NW limb,SWRC_CATALOG
290,2015-07-11T09:12:00-CME-001,2015-07-11 09:12:00,,,"['SOHO: LASCO/C2', 'SOHO: LASCO/C3']","[{'time21_5': '2015-07-11T21:38Z', 'latitude': 47.0, 'longitude': 100.0, 'halfAngle': 45.0, 'speed': 255.0, 'type': 'S', 'isMostAccurate': True, 'note': '', 'levelOfData': 0, 'enlilList': None}]",0,Associated eruption observed off of the NW limb in SDO AIA 304 starting around 2015-07-11T03:07Z.,SWRC_CATALOG
291,2015-07-12T11:24:00-CME-001,2015-07-12 11:24:00,,,"['SOHO: LASCO/C2', 'SOHO: LASCO/C3']",,0,"Narrow and difficult to see in C3
Unable to find a source in SDO 193/171/304",SWRC_CATALOG
292,2015-07-12T18:12:00-CME-001,2015-07-12 18:12:00,,,"['SOHO: LASCO/C2', 'SOHO: LASCO/C3']","[{'time21_5': '2015-07-13T00:48Z', 'latitude': 17.0, 'longitude': -97.0, 'halfAngle': 28.0, 'speed': 545.0, 'type': 'C', 'isMostAccurate': True, 'note': 'Measurement is somewhat rough, difficult to follow in C3', 'levelOfData': 0, 'enlilList': [{'modelCompletionTime': '2015-07-13T02:25Z', 'au': 2.0, 'estimatedShockArrivalTime': None, 'estimatedDuration': None, 'rmin_re': None, 'kp_18': None, 'kp_90': None, 'kp_135': None, 'kp_180': None, 'isEarthGB': False, 'impactList': [{'isGlancingBlow': False, 'location': 'Spitzer', 'arrivalTime': '2015-07-16T02:38Z'}], 'cmeIDs': ['2015-07-12T18:12:00-CME-001']}, {'modelCompletionTime': '2015-07-13T02:47Z', 'au': 5.5, 'estimatedShockArrivalTime': None, 'estimatedDuration': None, 'rmin_re': None, 'kp_18': None, 'kp_90': None, 'kp_135': None, 'kp_180': None, 'isEarthGB': False, 'impactList': [{'isGlancingBlow': False, 'location': 'Spitzer', 'arrivalTime': '2015-07-16T02:19Z'}], 'cmeIDs': ['2015-07-12T18:12:00-CME-001']}]}]",0,"Faint CME, looks like a single wide loop off the NE in C2/C3.
Around 17:30 - 18:00, some change in the field lines in the NE as seen in SDO 171 is visible. This may be from a behind limb source",SWRC_CATALOG
293,2015-07-13T00:24:00-CME-001,2015-07-13 00:24:00,,,"['SOHO: LASCO/C2', 'SOHO: LASCO/C3']","[{'time21_5': '2015-07-13T08:40Z', 'latitude': 49.0, 'longitude': 90.0, 'halfAngle': 14.0, 'speed': 415.0, 'type': 'S', 'isMostAccurate': True, 'note': 'Ragged-front CME, fading in the C3 FOV.  Measurements are plane-of-sky, but the CME appears to have originated close to the limb anyhow.', 'levelOfData': 0, 'enlilList': None}]",0,"Rising/opening loops visible starting ~22:00 off limb in the NW, especially in AIA 171.",SWRC_CATALOG
294,2015-07-13T09:36:00-CME-001,2015-07-13 09:36:00,"[-3, -50]",,"['SOHO: LASCO/C2', 'SOHO: LASCO/C3']","[{'time21_5': '2015-07-13T14:58Z', 'latitude': -10.0, 'longitude': -50.0, 'halfAngle': 21.0, 'speed': 635.0, 'type': 'C', 'isMostAccurate': True, 'note': 'CME longitude is based on the location of the source active region.  There is also a small spray from the same area at around 06:12 - the CME merges with this spray early in its transit.', 'levelOfData': 0, 'enlilList': [{'modelCompletionTime': '2015-07-13T19:47Z', 'au': 2.0, 'estimatedShockArrivalTime': None, 'estimatedDuration': None, 'rmin_re': None, 'kp_18': None, 'kp_90': None, 'kp_135': None, 'kp_180': None, 'isEarthGB': False, 'impactList': None, 'cmeIDs': ['2015-07-13T09:36:00-CME-001']}, {'modelCompletionTime': '2015-07-13T20:09Z', 'au': 5.5, 'estimatedShockArrivalTime': None, 'estimatedDuration': None, 'rmin_re': None, 'kp_18': None, 'kp_90': None, 'kp_135': None, 'kp_180': None, 'isEarthGB': False, 'impactList': None, 'cmeIDs': ['2015-07-13T09:36:00-CME-001']}]}]",0,A prominence eruption from a small unnumbered active region starting at 08:51Z.  Small 2-ribbon flare and dimming.,SWRC_CATALOG
295,2015-07-14T06:36:00-CME-001,2015-07-14 06:36:00,"[20, -90]",12381.0,"['SOHO: LASCO/C2', 'SOHO: LASCO/C3', 'STEREO A: SECCHI/COR2']","[{'time21_5': '2015-07-15T02:17Z', 'latitude': 17.0, 'longitude': 90.0, 'halfAngle': 28.0, 'speed': 185.0, 'type': 'S', 'isMostAccurate': True, 'note': 'Measurements are plane-of-sky, but the origin is probably close to 90W anyhow.  CME has a multi-loop structure.', 'levelOfData': 0, 'enlilList': None}]",0,"CME began as rising loops above AR 2381 in the NW starting around ~6:00, most visible in AIA 171 Å.",SWRC_CATALOG
296,2015-07-14T10:00:00-CME-001,2015-07-14 10:00:00,,,"['SOHO: LASCO/C2', 'SOHO: LASCO/C3', 'STEREO A: SECCHI/COR2']","[{'time21_5': '2015-07-15T06:02Z', 'latitude': -50.0, 'longitude': -129.0, 'halfAngle': 25.0, 'speed': 180.0, 'type': 'S', 'isMostAccurate': True, 'note': 'This CME was hard to measure.  Assumed longitude was based on location of filament on far side of Sun.  This CME may be part of another DONKI CME entry: 2015-07-14T12:00Z.', 'levelOfData': 0, 'enlilList': None}]",0,Visible in AIA 171 as rising loops off the SE limb starting ~09:00Z.  CME is likely associated with the southern filament channel on the far side of the Sun.  This CME may be part of another DONKI CME entry: 2015-07-14T12:00Z.,SWRC_CATALOG
297,2015-07-14T12:00:00-CME-001,2015-07-14 12:00:00,,,"['SOHO: LASCO/C2', 'SOHO: LASCO/C3', 'STEREO A: SECCHI/COR2']","[{'time21_5': '2015-07-15T03:40Z', 'latitude': -50.0, 'longitude': 168.0, 'halfAngle': 29.0, 'speed': 220.0, 'type': 'S', 'isMostAccurate': True, 'note': ""This may be part of the 2015-07-14Z10:00Z CME, not clear if it's a complex single CME or two separate ones."", 'levelOfData': 0, 'enlilList': None}]",0,"Visible in AIA 171 images as rising loops above the south pole starting ~ 09:00Z.  CME is likely associated with the southern filament channel on the far side of the Sun.  May be the same CME as the 2015-07-14T10:00Z CME, just two separate loop systems.",SWRC_CATALOG
298,2015-07-16T18:00:00-CME-001,2015-07-16 18:00:00,,,"['SOHO: LASCO/C2', 'SOHO: LASCO/C3']","[{'time21_5': '2015-07-16T22:07Z', 'latitude': 80.0, 'longitude': -3.0, 'halfAngle': 13.0, 'speed': 870.0, 'type': 'C', 'isMostAccurate': True, 'note': 'use SWPC_cat for parameters, fit 5 C3 images, CME seems very high lat, CME quite faint and to the north, although filament source is at lower lat and in the eastern quadrant. some fits give higher speeds >1000 km/s and lower lat.', 'levelOfData': 0, 'enlilList': None}]",0,"Source of the CME is a filament eruption starting at ~14:20 around N30E30 in SDO 193 and 304, very nice eruption in 304, rotation of filament, AIA 193 shows dimmings and wave to the north. second filament eruption was triggered, seen in AIA 304 at ~21.30 (second filament located north of the first one). CME in C2/3 is very faint and straight to the north.",SWRC_CATALOG
299,2015-07-17T06:12:00-CME-001,2015-07-17 06:12:00,"[10, -55]",12388.0,"['SOHO: LASCO/C2', 'SOHO: LASCO/C3']","[{'time21_5': '2015-07-17T17:52Z', 'latitude': 10.0, 'longitude': 55.0, 'halfAngle': 9.0, 'speed': 350.0, 'type': 'S', 'isMostAccurate': True, 'note': 'CME very faint in C3, use AR 12388 as source for lat.', 'levelOfData': 0, 'enlilList': None}]",0,faint signs of eruption in AR 12388 at ~05:00 in AIA 304.,SWRC_CATALOG
300,2015-07-17T16:24:00-CME-001,2015-07-17 16:24:00,,,"['SOHO: LASCO/C2', 'SOHO: LASCO/C3']","[{'time21_5': '2015-07-18T19:16Z', 'latitude': 0.0, 'longitude': 90.0, 'halfAngle': 30.0, 'speed': 133.0, 'type': 'S', 'isMostAccurate': True, 'note': '', 'levelOfData': 0, 'enlilList': None}]",0,Associated with a small eruption near the eastern limb as seen in SDO AIA 304 around 2015-07-18T14:48Z.,SWRC_CATALOG
301,2015-07-18T00:00:00-CME-001,2015-07-18 00:00:00,,,"['SOHO: LASCO/C2', 'SOHO: LASCO/C3']","[{'time21_5': '2015-07-18T17:33Z', 'latitude': 15.0, 'longitude': 100.0, 'halfAngle': 39.0, 'speed': 208.0, 'type': 'S', 'isMostAccurate': True, 'note': '', 'levelOfData': 0, 'enlilList': None}]",0,Associated with rising loops observed in SDO AIA 193 around 2015-07-18T22:00Z.,SWRC_CATALOG
302,2015-07-18T04:48:00-CME-001,2015-07-18 04:48:00,,,"['SOHO: LASCO/C2', 'SOHO: LASCO/C3']","[{'time21_5': '2015-07-18T21:53Z', 'latitude': 10.0, 'longitude': 92.0, 'halfAngle': 32.0, 'speed': 212.0, 'type': 'S', 'isMostAccurate': True, 'note': '', 'levelOfData': 0, 'enlilList': None}]",0,Associated with a filament eruption observed in SDO AIA 304 around 2015-07-18T02:27Z.,SWRC_CATALOG
303,2015-07-18T13:25:00-CME-001,2015-07-18 13:25:00,,,"['SOHO: LASCO/C2', 'SOHO: LASCO/C3']","[{'time21_5': '2015-07-19T05:13Z', 'latitude': 12.0, 'longitude': 91.0, 'halfAngle': 30.0, 'speed': 222.0, 'type': 'S', 'isMostAccurate': True, 'note': '', 'levelOfData': 0, 'enlilList': None}]",0,Possibly associated with a small eruption around 2015-07-18T09:51Z off of western limb in SDO AIA 304.,SWRC_CATALOG
304,2015-07-18T15:12:00-CME-001,2015-07-18 15:12:00,,,"['SOHO: LASCO/C2', 'SOHO: LASCO/C3']","[{'time21_5': '2015-07-19T01:57Z', 'latitude': 20.0, 'longitude': 92.0, 'halfAngle': 42.0, 'speed': 331.0, 'type': 'S', 'isMostAccurate': True, 'note': '', 'levelOfData': 0, 'enlilList': None}]",0,Associated with an eruption/opening field lines around 2015-07-18T14:36Z as seen off of the western limb in SDO AIA 193.,SWRC_CATALOG
305,2015-07-18T20:12:00-CME-001,2015-07-18 20:12:00,,,['SOHO: LASCO/C2'],"[{'time21_5': '2015-07-19T10:13Z', 'latitude': 9.0, 'longitude': 95.0, 'halfAngle': 23.0, 'speed': 257.0, 'type': 'S', 'isMostAccurate': True, 'note': '', 'levelOfData': 0, 'enlilList': None}]",0,Source could not be found. Likely associated with a back-sided eruption behind the western limb.,SWRC_CATALOG
306,2015-07-18T23:26:00-CME-001,2015-07-18 23:26:00,,,"['SOHO: LASCO/C2', 'SOHO: LASCO/C3', 'STEREO A: SECCHI/COR2']","[{'time21_5': '2015-07-19T10:52Z', 'latitude': 41.0, 'longitude': 124.0, 'halfAngle': 20.0, 'speed': 316.0, 'type': 'S', 'isMostAccurate': True, 'note': 'Longitude identified using STEREO A and SOHO data. Very high northern latitude. Rising loops along the north east limb in SDO AIA 171 were seen around 22UT', 'levelOfData': 0, 'enlilList': None}]",0,"Far sided and high northern latitude. Most images are from C2 and C3, but STA has 2 images of the CME.",SWRC_CATALOG
307,2015-07-19T03:48:00-CME-001,2015-07-19 03:48:00,,,"['SOHO: LASCO/C2', 'SOHO: LASCO/C3', 'STEREO A: SECCHI/COR2']","[{'time21_5': '2015-07-20T05:56Z', 'latitude': 37.0, 'longitude': None, 'halfAngle': 22.0, 'speed': 138.0, 'type': 'S', 'isMostAccurate': True, 'note': '', 'levelOfData': 0, 'enlilList': None}]",0,This CME was backsided but close to the northwestern limb as seen as rising loops in SDO AIA 171 around 03:00Z. Rising loops could also be seen on the northeastern limb from STEREO A.,SWRC_CATALOG
308,2015-07-19T05:24:00-CME-001,2015-07-19 05:24:00,,12384.0,['SOHO: LASCO/C2'],"[{'time21_5': '2015-07-19T13:18Z', 'latitude': -28.0, 'longitude': 70.0, 'halfAngle': 26.0, 'speed': 483.0, 'type': 'S', 'isMostAccurate': True, 'note': '', 'levelOfData': 0, 'enlilList': None}]",0,Associated with a small eruption on SW limb in SDO around 2015-07-19T04:37Z near AR 2384.,SWRC_CATALOG
309,2015-07-19T09:48:00-CME-001,2015-07-19 09:48:00,,,"['SOHO: LASCO/C2', 'SOHO: LASCO/C3']","[{'time21_5': '2015-07-19T14:30Z', 'latitude': -19.0, 'longitude': 51.0, 'halfAngle': 38.0, 'speed': 763.0, 'type': 'C', 'isMostAccurate': True, 'note': '', 'levelOfData': 0, 'enlilList': [{'modelCompletionTime': '2015-07-20T14:48Z', 'au': 2.0, 'estimatedShockArrivalTime': '2015-07-22T18:00Z', 'estimatedDuration': None, 'rmin_re': None, 'kp_18': None, 'kp_90': 3, 'kp_135': 4, 'kp_180': 4, 'isEarthGB': True, 'impactList': None, 'cmeIDs': ['2015-07-19T09:48:00-CME-001']}]}, {'time21_5': '2015-07-19T14:35Z', 'latitude': -19.0, 'longitude': 61.0, 'halfAngle': 40.0, 'speed': 844.0, 'type': 'C', 'isMostAccurate': False, 'note': '', 'levelOfData': 0, 'enlilList': [{'modelCompletionTime': '2015-07-19T16:41Z', 'au': 5.5, 'estimatedShockArrivalTime': None, 'estimatedDuration': None, 'rmin_re': None, 'kp_18': None, 'kp_90': None, 'kp_135': None, 'kp_180': None, 'isEarthGB': False, 'impactList': None, 'cmeIDs': ['2015-07-19T09:48:00-CME-001']}, {'modelCompletionTime': '2015-07-19T19:29Z', 'au': 2.0, 'estimatedShockArrivalTime': None, 'estimatedDuration': None, 'rmin_re': None, 'kp_18': None, 'kp_90': None, 'kp_135': None, 'kp_180': None, 'isEarthGB': False, 'impactList': None, 'cmeIDs': ['2015-07-19T09:48:00-CME-001']}]}]",1,Associated with large eruption from SW limb in SDO AIA 193/304 around 2015-07-19T07:31Z.,SWRC_CATALOG
310,2015-07-20T08:48:00-CME-001,2015-07-20 08:48:00,"[45, -35]",,"['SOHO: LASCO/C2', 'SOHO: LASCO/C3']","[{'time21_5': '2015-07-20T19:42Z', 'latitude': 50.0, 'longitude': 36.0, 'halfAngle': 10.0, 'speed': 380.0, 'type': 'S', 'isMostAccurate': True, 'note': 'These measurements were made with SOHO LASCO C2.', 'levelOfData': 0, 'enlilList': None}]",0,This CME is very faint and small. It is associated with a filament eruption in the northwest around 07:00Z.,SWRC_CATALOG
311,2015-07-20T10:36:00-CME-001,2015-07-20 10:36:00,"[55, 20]",,"['SOHO: LASCO/C2', 'SOHO: LASCO/C3']","[{'time21_5': '2015-07-20T20:48Z', 'latitude': 51.0, 'longitude': -12.0, 'halfAngle': 10.0, 'speed': 328.0, 'type': 'S', 'isMostAccurate': True, 'note': 'Measurements were made with SOHO LASCO C2 only.', 'levelOfData': 0, 'enlilList': None}]",0,This CME is associated with a filament eruption around 07:00Z that was caused by the same activity that caused the filament eruption and CME in the northwest at 2015-07-20T08:48Z.,SWRC_CATALOG
312,2015-07-20T13:36:00-CME-001,2015-07-20 13:36:00,"[-12, -155]",,"['SOHO: LASCO/C2', 'SOHO: LASCO/C3']","[{'time21_5': '2015-07-20T22:14Z', 'latitude': -20.0, 'longitude': 155.0, 'halfAngle': 19.0, 'speed': 289.0, 'type': 'S', 'isMostAccurate': True, 'note': '', 'levelOfData': 0, 'enlilList': None}]",0,Believed to be associated with a small eruption visible in STA EUVI 195 starting 12:30Z. CME was very faint,SWRC_CATALOG
313,2015-07-21T18:00:00-CME-001,2015-07-21 18:00:00,,,"['SOHO: LASCO/C2', 'SOHO: LASCO/C3', 'STEREO A: SECCHI/COR2']","[{'time21_5': '2015-07-22T03:23Z', 'latitude': 21.0, 'longitude': 115.0, 'halfAngle': 42.0, 'speed': 378.0, 'type': 'S', 'isMostAccurate': True, 'note': '', 'levelOfData': 0, 'enlilList': [{'modelCompletionTime': '2015-07-22T01:14Z', 'au': 2.0, 'estimatedShockArrivalTime': None, 'estimatedDuration': None, 'rmin_re': None, 'kp_18': None, 'kp_90': None, 'kp_135': None, 'kp_180': None, 'isEarthGB': False, 'impactList': None, 'cmeIDs': ['2015-07-21T18:00:00-CME-001']}]}]",0,Eruption can be seen faintly behind the NW limb in SDO AIA 193 around 2015-07-21T17:30Z and also in STEREO A EUVI 195 around 2015-07-21T17:12Z.,SWRC_CATALOG
314,2015-07-22T05:48:00-CME-001,2015-07-22 05:48:00,,,"['SOHO: LASCO/C2', 'SOHO: LASCO/C3', 'STEREO A: SECCHI/COR2']","[{'time21_5': '2015-07-22T17:22Z', 'latitude': -43.0, 'longitude': -27.0, 'halfAngle': 24.0, 'speed': 319.0, 'type': 'S', 'isMostAccurate': True, 'note': '', 'levelOfData': 0, 'enlilList': None}]",0,This CME is extremely dim. A source candidate is rising loops and a flare. Rising loops can be seen in STEREO A EUVI at 2015-07-21T23:00Z in the southeast and a flare can be seen at 2015-07-21T07:30Z at the same location.,SWRC_CATALOG
315,2015-07-23T00:00:00-CME-001,2015-07-23 00:00:00,,,"['SOHO: LASCO/C2', 'SOHO: LASCO/C3', 'STEREO A: SECCHI/COR2']","[{'time21_5': '2015-07-23T10:24Z', 'latitude': 37.0, 'longitude': 121.0, 'halfAngle': 26.0, 'speed': 322.0, 'type': 'S', 'isMostAccurate': True, 'note': '', 'levelOfData': 0, 'enlilList': [{'modelCompletionTime': '2015-07-23T20:56Z', 'au': 2.0, 'estimatedShockArrivalTime': None, 'estimatedDuration': None, 'rmin_re': None, 'kp_18': None, 'kp_90': None, 'kp_135': None, 'kp_180': None, 'isEarthGB': False, 'impactList': None, 'cmeIDs': ['2015-07-23T00:00:00-CME-001']}]}, {'time21_5': '2015-07-23T09:57Z', 'latitude': 37.0, 'longitude': 54.0, 'halfAngle': 20.0, 'speed': 325.0, 'type': 'S', 'isMostAccurate': False, 'note': '', 'levelOfData': 0, 'enlilList': None}]",0,CME source is not clear.  It appears to be coming from a backsided AR seen in STA EUVI around N30W35 looking at STA images.,SWRC_CATALOG
316,2015-07-23T12:00:00-CME-001,2015-07-23 12:00:00,"[-20, 70]",,['SOHO: LASCO/C2'],"[{'time21_5': '2015-07-24T01:57Z', 'latitude': -75.0, 'longitude': -33.0, 'halfAngle': 14.0, 'speed': 260.0, 'type': 'S', 'isMostAccurate': True, 'note': 'Measured in swpc_cat with only C2.  Very narrow and faint.', 'levelOfData': 0, 'enlilList': None}]",0,"The source of this narrow streamer CME is a small prominence near the SE limb visible in SDO AIA 304, 193, and 171 just after 11:12 UT.",SWRC_CATALOG
317,2015-07-24T16:36:00-CME-001,2015-07-24 16:36:00,"[30, -170]",,"['SOHO: LASCO/C2', 'SOHO: LASCO/C3', 'STEREO A: SECCHI/COR2']","[{'time21_5': '2015-07-25T01:30Z', 'latitude': 32.0, 'longitude': 161.0, 'halfAngle': 18.0, 'speed': 400.0, 'type': 'S', 'isMostAccurate': True, 'note': 'Measurement is rough and using primarily C2 imagery.', 'levelOfData': 0, 'enlilList': [{'modelCompletionTime': '2015-07-25T02:40Z', 'au': 2.0, 'estimatedShockArrivalTime': None, 'estimatedDuration': None, 'rmin_re': None, 'kp_18': None, 'kp_90': None, 'kp_135': None, 'kp_180': None, 'isEarthGB': False, 'impactList': None, 'cmeIDs': ['2015-07-24T16:36:00-CME-001']}]}]",0,"Backsided large dimming area seen in STA EUVI around 16:15Z.  CME is faint and slow and hardly seen in C3 imagery.

CME can also be seen in STA coronagraph imagery, but not used in analysis.",SWRC_CATALOG
318,2015-07-25T15:12:00-CME-001,2015-07-25 15:12:00,,,"['SOHO: LASCO/C2', 'SOHO: LASCO/C3', 'STEREO A: SECCHI/COR2']","[{'time21_5': '2015-07-25T22:08Z', 'latitude': 65.0, 'longitude': 110.0, 'halfAngle': 22.0, 'speed': 515.0, 'type': 'C', 'isMostAccurate': True, 'note': '', 'levelOfData': 0, 'enlilList': None}]",0,The eruption can be seen quite clearly off the NW limb in SDO AIA 304 beginning around 13:50 UT.,SWRC_CATALOG
319,2015-07-25T21:12:00-CME-001,2015-07-25 21:12:00,,,"['SOHO: LASCO/C2', 'SOHO: LASCO/C3', 'STEREO A: SECCHI/COR2']","[{'time21_5': '2015-07-26T02:00Z', 'latitude': 52.0, 'longitude': -107.0, 'halfAngle': 29.0, 'speed': 600.0, 'type': 'C', 'isMostAccurate': True, 'note': 'This measurement reflects the outer boundary measurement of the CME. The bright, inner portion of the CME produces lower speeds.', 'levelOfData': 0, 'enlilList': [{'modelCompletionTime': '2015-07-27T18:38Z', 'au': 2.0, 'estimatedShockArrivalTime': None, 'estimatedDuration': None, 'rmin_re': None, 'kp_18': None, 'kp_90': None, 'kp_135': None, 'kp_180': None, 'isEarthGB': False, 'impactList': None, 'cmeIDs': ['2015-07-25T21:12:00-CME-001']}]}, {'time21_5': '2015-07-26T04:08Z', 'latitude': 51.0, 'longitude': -124.0, 'halfAngle': 22.0, 'speed': 423.0, 'type': 'S', 'isMostAccurate': False, 'note': '', 'levelOfData': 0, 'enlilList': None}]",0,Backsided. The CME source can be seen as a filament eruption in STEREO A EUVI imagery around 17:40 off the NW limb. The eruption can also be seen in the NE of SDO AIA 304 imagery.,SWRC_CATALOG
320,2015-07-26T09:12:00-CME-001,2015-07-26 09:12:00,,,"['SOHO: LASCO/C2', 'SOHO: LASCO/C3', 'STEREO A: SECCHI/COR2']","[{'time21_5': '2015-07-26T18:48Z', 'latitude': 42.0, 'longitude': 168.0, 'halfAngle': 44.0, 'speed': 353.0, 'type': 'S', 'isMostAccurate': True, 'note': 'Good looking fit in SWPC Cat using some C2 imagery and mostly C3 imagery', 'levelOfData': 0, 'enlilList': [{'modelCompletionTime': '2015-07-27T00:53Z', 'au': 2.0, 'estimatedShockArrivalTime': None, 'estimatedDuration': None, 'rmin_re': None, 'kp_18': None, 'kp_90': None, 'kp_135': None, 'kp_180': None, 'isEarthGB': False, 'impactList': None, 'cmeIDs': ['2015-07-26T09:12:00-CME-001']}]}]",0,"May be associated with a small brightening seen in STA EUVI around 0800, but unsure...
No candidate found in SDO",SWRC_CATALOG
321,2015-07-28T13:00:00-CME-001,2015-07-28 13:00:00,,,"['SOHO: LASCO/C2', 'SOHO: LASCO/C3', 'STEREO A: SECCHI/COR2']","[{'time21_5': '2015-07-29T18:00Z', 'latitude': 68.0, 'longitude': -84.0, 'halfAngle': 25.0, 'speed': 93.0, 'type': 'S', 'isMostAccurate': True, 'note': '', 'levelOfData': 0, 'enlilList': None}]",0,The source location is unknown. Potentially some activity in the Northern region of SDO AIA 304 around 10 UT.,SWRC_CATALOG
322,2015-07-29T19:41:00-CME-001,2015-07-29 19:41:00,,,"['STEREO A: SECCHI/COR2', 'SOHO: LASCO/C2', 'SOHO: LASCO/C3']","[{'time21_5': '2015-07-30T09:38Z', 'latitude': -26.0, 'longitude': None, 'halfAngle': 21.0, 'speed': 243.0, 'type': 'S', 'isMostAccurate': True, 'note': 'Speed and longitude uncertain', 'levelOfData': 0, 'enlilList': None}]",0,Most likely back-sided since no eruptions/activity seen on the solar disk. Source location not found in STA EUVI either (there is a data gap preceding the start of CME though).,SWRC_CATALOG
323,2015-07-30T16:00:00-CME-001,2015-07-30 16:00:00,,,"['SOHO: LASCO/C2', 'SOHO: LASCO/C3']","[{'time21_5': '2015-07-31T04:47Z', 'latitude': 26.0, 'longitude': -137.0, 'halfAngle': 36.0, 'speed': 381.0, 'type': 'S', 'isMostAccurate': True, 'note': '', 'levelOfData': 0, 'enlilList': [{'modelCompletionTime': '2015-07-31T19:09Z', 'au': 2.0, 'estimatedShockArrivalTime': None, 'estimatedDuration': None, 'rmin_re': None, 'kp_18': None, 'kp_90': None, 'kp_135': None, 'kp_180': None, 'isEarthGB': False, 'impactList': None, 'cmeIDs': ['2015-07-30T16:00:00-CME-001']}]}, {'time21_5': '2015-07-31T07:27Z', 'latitude': 35.0, 'longitude': -135.0, 'halfAngle': 22.0, 'speed': 250.0, 'type': 'S', 'isMostAccurate': False, 'note': 'parameters from STEREO_cat with lon from source at ~ -135, CME very slow, hard to measure as only a few images close the sun are available - should be remeasured with updated data', 'levelOfData': 0, 'enlilList': None}]",0,"source of CME is far-sided, most likely AR to the NW in EUVI A, shows signs of eruption after data gap between 11.10 and 22.10, AR lon ~-135 deg - this is used for CME longitude",SWRC_CATALOG
324,2015-07-31T00:24:00-CME-001,2015-07-31 00:24:00,"[-21, -155]",,"['SOHO: LASCO/C2', 'SOHO: LASCO/C3', 'STEREO A: SECCHI/COR2']","[{'time21_5': '2015-07-31T23:05Z', 'latitude': -21.0, 'longitude': 155.0, 'halfAngle': 10.0, 'speed': 128.0, 'type': 'S', 'isMostAccurate': True, 'note': '', 'levelOfData': 0, 'enlilList': None}]",0,The source is an eruption in the southwest in STA EUVI around 00:10UT.,SWRC_CATALOG
325,2015-07-31T16:24:00-CME-001,2015-07-31 16:24:00,"[5, -40]",12392.0,"['SOHO: LASCO/C2', 'SOHO: LASCO/C3', 'STEREO A: SECCHI/COR2']","[{'time21_5': '2015-07-31T19:51Z', 'latitude': 0.0, 'longitude': -30.0, 'halfAngle': 10.0, 'speed': 488.0, 'type': 'S', 'isMostAccurate': True, 'note': '', 'levelOfData': 0, 'enlilList': [{'modelCompletionTime': '2015-08-01T15:33Z', 'au': 2.0, 'estimatedShockArrivalTime': None, 'estimatedDuration': None, 'rmin_re': None, 'kp_18': None, 'kp_90': None, 'kp_135': None, 'kp_180': None, 'isEarthGB': False, 'impactList': None, 'cmeIDs': ['2015-07-31T16:24:00-CME-001', '2015-07-31T17:37:00-CME-001']}]}, {'time21_5': '2015-07-31T22:39Z', 'latitude': 4.0, 'longitude': -51.0, 'halfAngle': 30.0, 'speed': 540.0, 'type': 'C', 'isMostAccurate': False, 'note': '', 'levelOfData': 0, 'enlilList': None}]",0,Associated with an eruption observed in SDO AIA 193/304 around 2015-07-31T15:44Z near AR 2392.,SWRC_CATALOG
326,2015-07-31T17:37:00-CME-001,2015-07-31 17:37:00,,,"['SOHO: LASCO/C2', 'SOHO: LASCO/C3']","[{'time21_5': '2015-08-01T01:50Z', 'latitude': 16.0, 'longitude': -100.0, 'halfAngle': 21.0, 'speed': 335.0, 'type': 'S', 'isMostAccurate': True, 'note': '', 'levelOfData': 0, 'enlilList': [{'modelCompletionTime': '2015-08-01T15:33Z', 'au': 2.0, 'estimatedShockArrivalTime': None, 'estimatedDuration': None, 'rmin_re': None, 'kp_18': None, 'kp_90': None, 'kp_135': None, 'kp_180': None, 'isEarthGB': False, 'impactList': None, 'cmeIDs': ['2015-07-31T16:24:00-CME-001', '2015-07-31T17:37:00-CME-001']}]}]",0,Associated with an eruption observed in SDO AIA 193/304 around 2015-07-31T16:58Z off of the eastern limb and in STEREO A EUVI around 2015-07-31T16:55Z.,SWRC_CATALOG
327,2015-08-01T00:00:00-CME-001,2015-08-01 00:00:00,,,"['SOHO: LASCO/C2', 'SOHO: LASCO/C3']","[{'time21_5': '2015-08-01T20:01Z', 'latitude': -30.0, 'longitude': -95.0, 'halfAngle': 22.0, 'speed': 171.0, 'type': 'S', 'isMostAccurate': True, 'note': '', 'levelOfData': 0, 'enlilList': None}]",0,Derived parameters are very approximate. No source for this faint/narrow CME could be found.,SWRC_CATALOG
