,activityID,startTime,sourceLocation,activeRegionNum,instruments,cmeAnalyses,linkedEvents,note,catalog
612,2016-03-30T13:09:00-CME-001,2016-03-30 13:09:00,,,"['STEREO A: SECCHI/COR2', 'SOHO: LASCO/C2']","[{'time21_5': '2016-03-30T21:37Z', 'latitude': -24.0, 'longitude': 134.0, 'halfAngle': 42.0, 'speed': 415.0, 'type': 'S', 'isMostAccurate': True, 'note': 'preliminary measurement using SWPC_cat with STA images only, should be remeasured with LASCO images. CME is rather faint further away from the disk.', 'levelOfData': 0, 'enlilList': None}]",0,"Eruption seen in EUVI A, starting ~09:45 in an AR in the NE quadrant, AR south of CH boundary, located at around lat=15, lon=160",SWRC_CATALOG
613,2016-03-31T01:25:00-CME-001,2016-03-31 01:25:00,"[-30, -51]",,"['SOHO: LASCO/C2', 'SOHO: LASCO/C3', 'STEREO A: SECCHI/COR2']","[{'time21_5': '2016-03-31T08:18Z', 'latitude': -32.0, 'longitude': 48.0, 'halfAngle': 18.0, 'speed': 470.0, 'type': 'S', 'isMostAccurate': True, 'note': '', 'levelOfData': 1, 'enlilList': [{'modelCompletionTime': '2016-03-31T19:27Z', 'au': 2.0, 'estimatedShockArrivalTime': None, 'estimatedDuration': None, 'rmin_re': None, 'kp_18': None, 'kp_90': None, 'kp_135': None, 'kp_180': None, 'isEarthGB': False, 'impactList': None, 'cmeIDs': ['2016-03-31T01:25:00-CME-001']}]}]",1,CME is associated with a small eruption visible in the SW in SDO 171/193/304.  CME is very faint.  Measurements are very preliminary.,SWRC_CATALOG
614,2016-04-01T12:48:00-CME-001,2016-04-01 12:48:00,"[-40, -75]",,['SOHO: LASCO/C2'],"[{'time21_5': '2016-04-02T04:00Z', 'latitude': -22.0, 'longitude': 73.0, 'halfAngle': 24.0, 'speed': 237.0, 'type': 'S', 'isMostAccurate': True, 'note': 'Measurement done using SWPC_Cat C2 and C3 imagery.', 'levelOfData': 0, 'enlilList': None}, {'time21_5': None, 'latitude': -23.0, 'longitude': 73.0, 'halfAngle': 27.0, 'speed': 222.0, 'type': 'S', 'isMostAccurate': False, 'note': 'Measured with SOHO C2 only in swpc_cat.  Time 21.5 2016-04-02T05:20Z', 'levelOfData': 0, 'enlilList': None}]",0,Source is likely small eruption in SW visible in SDO AIA 171 and 193 with dimming and some opening of field lines.,SWRC_CATALOG
615,2016-04-02T20:42:00-CME-001,2016-04-02 20:42:00,,,['SOHO: LASCO/C3'],"[{'time21_5': '2016-04-03T05:46Z', 'latitude': -22.0, 'longitude': -102.0, 'halfAngle': 30.0, 'speed': 303.0, 'type': 'S', 'isMostAccurate': True, 'note': 'The source is unknown, likely back sided, near the eastern limb.', 'levelOfData': 2, 'enlilList': None}]",0,,SWRC_CATALOG
616,2016-04-03T01:25:00-CME-001,2016-04-03 01:25:00,,,"['SOHO: LASCO/C2', 'SOHO: LASCO/C3']","[{'time21_5': '2016-04-03T13:17Z', 'latitude': -26.0, 'longitude': 46.0, 'halfAngle': 12.0, 'speed': 280.0, 'type': 'S', 'isMostAccurate': True, 'note': 'These are very preliminary measurements using C2 in swpc_cat.', 'levelOfData': 0, 'enlilList': None}]",0,The source location is unknown. This CME was very faint and narrow,SWRC_CATALOG
617,2016-04-04T04:39:00-CME-001,2016-04-04 04:39:00,"[30, 80]",,"['STEREO A: SECCHI/COR2', 'SOHO: LASCO/C2', 'SOHO: LASCO/C3']","[{'time21_5': '2016-04-04T14:03Z', 'latitude': 30.0, 'longitude': -80.0, 'halfAngle': 32.0, 'speed': 435.0, 'type': 'S', 'isMostAccurate': True, 'note': '', 'levelOfData': 1, 'enlilList': [{'modelCompletionTime': '2016-04-04T13:48Z', 'au': 2.0, 'estimatedShockArrivalTime': None, 'estimatedDuration': None, 'rmin_re': None, 'kp_18': None, 'kp_90': None, 'kp_135': None, 'kp_180': None, 'isEarthGB': False, 'impactList': None, 'cmeIDs': ['2016-04-04T04:39:00-CME-001']}]}]",0,CME associated with a large filament eruption observed on the NE in SDO 193/171/304.  CME is slow but it has a very nice symmetric shape.,SWRC_CATALOG
618,2016-04-05T06:12:00-CME-001,2016-04-05 06:12:00,,,"['SOHO: LASCO/C2', 'STEREO A: SECCHI/COR2']","[{'time21_5': '2016-04-05T14:25Z', 'latitude': -22.0, 'longitude': 95.0, 'halfAngle': 19.0, 'speed': 445.0, 'type': 'S', 'isMostAccurate': True, 'note': 'Measurements preliminary, based on close to Sun detection only.', 'levelOfData': 0, 'enlilList': None}]",0,"The associated eruption was observed by STA EUVI, close to the east limb (as seen from) STA corresponding to roughly W120S25 starting at ~03:55.",SWRC_CATALOG
619,2016-04-05T12:36:00-CME-001,2016-04-05 12:36:00,,,"['SOHO: LASCO/C2', 'SOHO: LASCO/C3', 'STEREO A: SECCHI/COR2']","[{'time21_5': '2016-04-07T02:12Z', 'latitude': 50.0, 'longitude': 19.0, 'halfAngle': 48.0, 'speed': 100.0, 'type': 'S', 'isMostAccurate': True, 'note': 'Triangulation measurements with SWPC_Cat indicated a pretty clear front-sided source; attempts to fit the CME with back-sided longitudes were far off.   CME leading edge was pretty faint by the time it got to the edge of the STA COR2 FOV.', 'levelOfData': 0, 'enlilList': None}]",0,"It's not clear what the source of this CME is.  There is some evolution in the north of AIA images (particularly 193A) near the coronal hole boundary after 11:00Z, this may be a very faint filament channel eruption (without much filament) or it may have a different source.",SWRC_CATALOG
620,2016-04-06T16:24:00-CME-001,2016-04-06 16:24:00,,,"['STEREO A: SECCHI/COR2', 'SOHO: LASCO/C2', 'SOHO: LASCO/C3']","[{'time21_5': '2016-04-06T23:36Z', 'latitude': 23.0, 'longitude': 14.0, 'halfAngle': 31.0, 'speed': 464.0, 'type': 'S', 'isMostAccurate': True, 'note': '', 'levelOfData': 1, 'enlilList': [{'modelCompletionTime': '2016-04-07T00:49Z', 'au': 2.0, 'estimatedShockArrivalTime': '2016-04-09T18:00Z', 'estimatedDuration': None, 'rmin_re': None, 'kp_18': None, 'kp_90': None, 'kp_135': None, 'kp_180': None, 'isEarthGB': True, 'impactList': [{'isGlancingBlow': True, 'location': 'Mars', 'arrivalTime': '2016-04-12T00:00Z'}], 'cmeIDs': ['2016-04-06T16:24:00-CME-001']}]}, {'time21_5': '2016-04-06T23:26Z', 'latitude': 23.0, 'longitude': 14.0, 'halfAngle': 31.0, 'speed': 464.0, 'type': 'S', 'isMostAccurate': False, 'note': 'This measurement was done using early C3 images as well as Stereo A images in SWPC_cat', 'levelOfData': 0, 'enlilList': None}]",1,"filament eruption close to central meridian in the north hemisphere, actual filament lift-off is not visible in AIA, but post-eruptive arcade and double ribbons can be seen in AIA 193 and 304 starting at ~14:00.",SWRC_CATALOG
621,2016-04-07T10:09:00-CME-001,2016-04-07 10:09:00,"[30, 50]",,['STEREO A: SECCHI/COR2'],"[{'time21_5': '2016-04-07T17:14Z', 'latitude': 30.0, 'longitude': -45.0, 'halfAngle': 13.0, 'speed': 340.0, 'type': 'S', 'isMostAccurate': True, 'note': '', 'levelOfData': 0, 'enlilList': None}]",0,"The very narrow CME is associated with a very interesting eruption visible in 193/171 starting around 09UT. Twisting of the field lines is visible specifically on SDO 171.  However, the CME is very faint.  Measurements are done using POS approximation.",SWRC_CATALOG
622,2016-04-07T23:36:00-CME-001,2016-04-07 23:36:00,,,"['SOHO: LASCO/C2', 'SOHO: LASCO/C3', 'STEREO A: SECCHI/COR2']","[{'time21_5': '2016-04-08T04:15Z', 'latitude': 0.0, 'longitude': 120.0, 'halfAngle': 33.0, 'speed': 740.0, 'type': 'C', 'isMostAccurate': True, 'note': '', 'levelOfData': 0, 'enlilList': [{'modelCompletionTime': '2016-04-08T15:39Z', 'au': 2.0, 'estimatedShockArrivalTime': None, 'estimatedDuration': None, 'rmin_re': None, 'kp_18': None, 'kp_90': None, 'kp_135': None, 'kp_180': None, 'isEarthGB': False, 'impactList': [{'isGlancingBlow': False, 'location': 'STEREO B', 'arrivalTime': '2016-04-10T07:16Z'}], 'cmeIDs': ['2016-04-07T23:36:00-CME-001']}, {'modelCompletionTime': '2016-04-08T15:49Z', 'au': 5.5, 'estimatedShockArrivalTime': None, 'estimatedDuration': None, 'rmin_re': None, 'kp_18': None, 'kp_90': None, 'kp_135': None, 'kp_180': None, 'isEarthGB': False, 'impactList': [{'isGlancingBlow': False, 'location': 'STEREO B', 'arrivalTime': '2016-04-10T07:02Z'}], 'cmeIDs': ['2016-04-07T23:36:00-CME-001']}]}]",0,"Eruption from behind the W limb (close at equator) seen in AIA 193 at ~23:00 UT, also seen in EUVI A at the east limb.",SWRC_CATALOG
623,2016-04-08T12:00:00-CME-001,2016-04-08 12:00:00,,,"['SOHO: LASCO/C2', 'SOHO: LASCO/C3', 'STEREO A: SECCHI/COR2']","[{'time21_5': '2016-04-08T21:22Z', 'latitude': 33.0, 'longitude': None, 'halfAngle': 22.0, 'speed': 417.0, 'type': 'S', 'isMostAccurate': True, 'note': 'Measured with C2 and Cor2 imagery in swpc_cat.  Leading edge not well defined.', 'levelOfData': 0, 'enlilList': None}]",0,Source is likely dimming in STEREO A EUV north-west quadrant starting at about 2016-04-08T10:30Z,SWRC_CATALOG
624,2016-04-08T23:13:00-CME-001,2016-04-08 23:13:00,,,"['SOHO: LASCO/C3', 'SOHO: LASCO/C2', 'STEREO A: SECCHI/COR2']","[{'time21_5': '2016-04-09T02:36Z', 'latitude': -24.0, 'longitude': 97.0, 'halfAngle': 15.0, 'speed': 454.0, 'type': 'S', 'isMostAccurate': True, 'note': 'Measurements done in SWPC_Cat using both C2 and C3 imagery.', 'levelOfData': 0, 'enlilList': [{'modelCompletionTime': '2016-04-09T16:12Z', 'au': 2.0, 'estimatedShockArrivalTime': None, 'estimatedDuration': None, 'rmin_re': None, 'kp_18': None, 'kp_90': None, 'kp_135': None, 'kp_180': None, 'isEarthGB': False, 'impactList': None, 'cmeIDs': ['2016-04-08T23:13:00-CME-001']}]}]",0,This CME is caused by a small eruption that can be seen in the SW of SDO at ~17:45Z.  The CME is very thin.,SWRC_CATALOG
625,2016-04-09T13:36:00-CME-001,2016-04-09 13:36:00,"[11, 60]",12529.0,"['SOHO: LASCO/C2', 'SOHO: LASCO/C3', 'STEREO A: SECCHI/COR2']","[{'time21_5': '2016-04-10T00:09Z', 'latitude': 14.0, 'longitude': -65.0, 'halfAngle': 20.0, 'speed': 311.0, 'type': 'S', 'isMostAccurate': True, 'note': 'These measurements were taken using LASCO C3 imagery in swpc_cat.', 'levelOfData': 0, 'enlilList': [{'modelCompletionTime': '2016-04-09T20:20Z', 'au': 2.0, 'estimatedShockArrivalTime': None, 'estimatedDuration': None, 'rmin_re': None, 'kp_18': None, 'kp_90': None, 'kp_135': None, 'kp_180': None, 'isEarthGB': False, 'impactList': None, 'cmeIDs': ['2016-04-09T13:36:00-CME-001']}]}]",1,"This CME was seen as opening and closing field lines as well as dimming in SDO AIA 193, from AR 2529 in the NE. It is associated with a long duration C2.8 flare.",SWRC_CATALOG
626,2016-04-09T20:30:00-CME-001,2016-04-09 20:30:00,,,"['SOHO: LASCO/C3', 'SOHO: LASCO/C2']","[{'time21_5': '2016-04-10T07:49Z', 'latitude': -29.0, 'longitude': 23.0, 'halfAngle': 26.0, 'speed': 263.0, 'type': 'S', 'isMostAccurate': True, 'note': '', 'levelOfData': 1, 'enlilList': None}]",0,"filament lifting off seen in AIA 304 at ~10:00 UT (with slow rise phase starting a few hours before that), filament seen to move to the SW. Eruption also faintly seen in AIA 193, only small part of a very long filament channel is erupting (eastern end of the channel).",SWRC_CATALOG
627,2016-04-10T07:12:00-CME-001,2016-04-10 07:12:00,"[10, 60]",12529.0,"['SOHO: LASCO/C2', 'SOHO: LASCO/C3', 'STEREO A: SECCHI/COR2']","[{'time21_5': None, 'latitude': 28.0, 'longitude': -53.0, 'halfAngle': 36.0, 'speed': 352.0, 'type': 'S', 'isMostAccurate': True, 'note': '', 'levelOfData': 1, 'enlilList': [{'modelCompletionTime': '2016-04-11T00:54Z', 'au': 2.0, 'estimatedShockArrivalTime': '2016-04-14T00:00Z', 'estimatedDuration': None, 'rmin_re': None, 'kp_18': None, 'kp_90': None, 'kp_135': None, 'kp_180': None, 'isEarthGB': True, 'impactList': None, 'cmeIDs': ['2016-04-10T07:12:00-CME-001', '2016-04-10T11:00:00-CME-001']}]}, {'time21_5': '2016-04-10T18:14Z', 'latitude': 28.0, 'longitude': -53.0, 'halfAngle': 36.0, 'speed': 352.0, 'type': 'S', 'isMostAccurate': False, 'note': 'These measurements were taken using LASCO C3 and STA coronagrpah imagery in swpc_cat.', 'levelOfData': 0, 'enlilList': [{'modelCompletionTime': '2016-04-10T12:35Z', 'au': 2.0, 'estimatedShockArrivalTime': None, 'estimatedDuration': None, 'rmin_re': None, 'kp_18': None, 'kp_90': None, 'kp_135': None, 'kp_180': None, 'isEarthGB': False, 'impactList': None, 'cmeIDs': ['2016-04-10T07:12:00-CME-001']}]}]",1,This CME was associated with opening and closing field lines seen in SDO AIA 193 and 171 around 05:58Z from AR2529 in the NE.,SWRC_CATALOG
628,2016-04-10T11:00:00-CME-001,2016-04-10 11:00:00,"[10, 30]",,"['SOHO: LASCO/C2', 'SOHO: LASCO/C3', 'STEREO A: SECCHI/COR2']","[{'time21_5': None, 'latitude': 34.0, 'longitude': -24.0, 'halfAngle': 35.0, 'speed': 521.0, 'type': 'C', 'isMostAccurate': True, 'note': '', 'levelOfData': 1, 'enlilList': [{'modelCompletionTime': '2016-04-11T00:54Z', 'au': 2.0, 'estimatedShockArrivalTime': '2016-04-14T00:00Z', 'estimatedDuration': None, 'rmin_re': None, 'kp_18': None, 'kp_90': None, 'kp_135': None, 'kp_180': None, 'isEarthGB': True, 'impactList': None, 'cmeIDs': ['2016-04-10T07:12:00-CME-001', '2016-04-10T11:00:00-CME-001']}]}, {'time21_5': '2016-04-10T17:21Z', 'latitude': 34.0, 'longitude': -24.0, 'halfAngle': 35.0, 'speed': 521.0, 'type': 'C', 'isMostAccurate': False, 'note': 'Measured with swpc_cat using C3 and Cor2 imagery.  This CME merged with the earlier 2016-04-10T07:12Z CME.', 'levelOfData': 0, 'enlilList': None}]",1,"Source is filament eruption near AR2529 around 10:06Z in SDO AIA 193, 171, and 304 with opening field lines visible off the limb of STA EUVI imagery.",SWRC_CATALOG
629,2016-04-11T09:24:00-CME-001,2016-04-11 09:24:00,"[20, 70]",,['STEREO A: SECCHI/COR2'],"[{'time21_5': '2016-04-11T17:34Z', 'latitude': 32.0, 'longitude': -110.0, 'halfAngle': 31.0, 'speed': 369.0, 'type': 'S', 'isMostAccurate': True, 'note': '', 'levelOfData': 0, 'enlilList': None}]",0,This CME may be associated with the AR visible in STA EUVI close to the west limb and the eruption visible in SDO 913/171 on the east limb.  The CME is very faint in STA COR2.  Measurements are very rough.,SWRC_CATALOG
630,2016-04-12T02:24:00-CME-001,2016-04-12 02:24:00,,,"['SOHO: LASCO/C2', 'SOHO: LASCO/C3', 'STEREO A: SECCHI/COR2']","[{'time21_5': '2016-04-12T12:28Z', 'latitude': -16.0, 'longitude': -173.0, 'halfAngle': 44.0, 'speed': 380.0, 'type': 'S', 'isMostAccurate': True, 'note': 'Complex appearance.', 'levelOfData': 0, 'enlilList': [{'modelCompletionTime': '2016-04-12T13:52Z', 'au': 2.0, 'estimatedShockArrivalTime': None, 'estimatedDuration': None, 'rmin_re': None, 'kp_18': None, 'kp_90': None, 'kp_135': None, 'kp_180': None, 'isEarthGB': False, 'impactList': [{'isGlancingBlow': True, 'location': 'STEREO A', 'arrivalTime': '2016-04-15T12:00Z'}], 'cmeIDs': ['2016-04-12T02:24:00-CME-001']}]}]",1,The CME is a complex partial halo. It is associated with a filament eruption at the back-side which can be observed in AIA 304 over the south limb starting at 2016-04-11T23:37.,SWRC_CATALOG
631,2016-04-13T18:24:00-CME-001,2016-04-13 18:24:00,,,"['SOHO: LASCO/C2', 'SOHO: LASCO/C3']","[{'time21_5': '2016-04-14T05:50Z', 'latitude': 30.0, 'longitude': 107.0, 'halfAngle': 24.0, 'speed': 309.0, 'type': 'S', 'isMostAccurate': True, 'note': 'Measured in swpc_cat with C2 imagery (arm blocked CME in C2).', 'levelOfData': 0, 'enlilList': None}]",0,Likely source is small eruption see in the NE of STA EUVI 195 at around 17:25.,SWRC_CATALOG
632,2016-04-14T11:36:00-CME-001,2016-04-14 11:36:00,,,"['SOHO: LASCO/C2', 'SOHO: LASCO/C3', 'STEREO A: SECCHI/COR2']","[{'time21_5': '2016-04-15T05:30Z', 'latitude': 23.0, 'longitude': 110.0, 'halfAngle': 21.0, 'speed': 193.0, 'type': 'S', 'isMostAccurate': True, 'note': '', 'levelOfData': 0, 'enlilList': None}]",0,CME may be associated with activity recorded at an active region seen at the NE on STA EUVI.,SWRC_CATALOG
633,2016-04-15T15:24:00-CME-001,2016-04-15 15:24:00,,,"['SOHO: LASCO/C2', 'SOHO: LASCO/C3']","[{'time21_5': '2016-04-16T02:03Z', 'latitude': 18.0, 'longitude': -122.0, 'halfAngle': 10.0, 'speed': 328.0, 'type': 'S', 'isMostAccurate': True, 'note': 'Measurement  done using SWPC cat and shows a very narrow and slow moving CME', 'levelOfData': 0, 'enlilList': None}]",0,Source location is unclear although it is apparent that it is back sided.,SWRC_CATALOG
634,2016-04-16T10:24:00-CME-001,2016-04-16 10:24:00,,,"['SOHO: LASCO/C3', 'SOHO: LASCO/C2']","[{'time21_5': '2016-04-16T18:10Z', 'latitude': -30.0, 'longitude': -85.0, 'halfAngle': 25.0, 'speed': 369.0, 'type': 'S', 'isMostAccurate': True, 'note': 'No source region could be identified because this CME started out as a streamer and slowly became larger.', 'levelOfData': 2, 'enlilList': None}]",0,,SWRC_CATALOG
635,2016-04-16T21:54:00-CME-001,2016-04-16 21:54:00,,12529.0,"['SOHO: LASCO/C3', 'SOHO: LASCO/C2']","[{'time21_5': '2016-04-17T09:39Z', 'latitude': 4.0, 'longitude': 43.0, 'halfAngle': 36.0, 'speed': 254.0, 'type': 'S', 'isMostAccurate': True, 'note': '', 'levelOfData': 0, 'enlilList': None}, {'time21_5': '2016-04-17T06:42Z', 'latitude': 4.0, 'longitude': 63.0, 'halfAngle': 27.0, 'speed': 335.0, 'type': 'S', 'isMostAccurate': False, 'note': '', 'levelOfData': 1, 'enlilList': None}]",0,,SWRC_CATALOG
636,2016-04-18T00:36:00-CME-001,2016-04-18 00:36:00,"[10, -51]",12529.0,"['SOHO: LASCO/C3', 'SOHO: LASCO/C2', 'STEREO A: SECCHI/COR2']","[{'time21_5': '2016-04-18T04:49Z', 'latitude': 9.0, 'longitude': 58.0, 'halfAngle': 37.0, 'speed': 689.0, 'type': 'C', 'isMostAccurate': True, 'note': 'CME associated with M6.7 class flare that peaked at 2016-04-18T00:29Z from AR 2529.', 'levelOfData': 1, 'enlilList': [{'modelCompletionTime': '2016-04-18T13:23Z', 'au': 2.0, 'estimatedShockArrivalTime': None, 'estimatedDuration': None, 'rmin_re': None, 'kp_18': None, 'kp_90': None, 'kp_135': None, 'kp_180': None, 'isEarthGB': False, 'impactList': None, 'cmeIDs': ['2016-04-18T00:36:00-CME-001']}]}, {'time21_5': '2016-04-18T00:36Z', 'latitude': 18.0, 'longitude': 54.0, 'halfAngle': 27.0, 'speed': 820.0, 'type': 'C', 'isMostAccurate': False, 'note': '', 'levelOfData': 1, 'enlilList': [{'modelCompletionTime': '2016-04-18T03:36Z', 'au': 2.0, 'estimatedShockArrivalTime': None, 'estimatedDuration': None, 'rmin_re': None, 'kp_18': None, 'kp_90': None, 'kp_135': None, 'kp_180': None, 'isEarthGB': False, 'impactList': None, 'cmeIDs': ['2016-04-18T00:36:00-CME-001']}]}]",1,,SWRC_CATALOG
637,2016-04-19T09:36:00-CME-001,2016-04-19 09:36:00,"[20, -20]",,"['SOHO: LASCO/C2', 'SOHO: LASCO/C3', 'STEREO A: SECCHI/COR2']","[{'time21_5': '2016-04-19T17:42Z', 'latitude': 13.0, 'longitude': 5.0, 'halfAngle': 38.0, 'speed': 328.0, 'type': 'S', 'isMostAccurate': True, 'note': '', 'levelOfData': 0, 'enlilList': None}]",0,Eruption from AR located at the far side seen in STA EUVI starting after 09UT.  Measurements are very rough since the CME is very faint.,SWRC_CATALOG
638,2016-04-21T00:09:00-CME-001,2016-04-21 00:09:00,,,"['STEREO A: SECCHI/COR2', 'SOHO: LASCO/C2', 'SOHO: LASCO/C3']","[{'time21_5': '2016-04-21T09:10Z', 'latitude': 7.0, 'longitude': -109.0, 'halfAngle': 10.0, 'speed': 283.0, 'type': 'S', 'isMostAccurate': True, 'note': '', 'levelOfData': 0, 'enlilList': None}]",0,Very narrow streamer from far sided AR seen in STA EUVI on the NW.,SWRC_CATALOG
639,2016-04-24T04:24:00-CME-001,2016-04-24 04:24:00,,,"['SOHO: LASCO/C2', 'SOHO: LASCO/C3', 'STEREO A: SECCHI/COR2']","[{'time21_5': '2016-04-24T11:14Z', 'latitude': 24.0, 'longitude': 115.0, 'halfAngle': 40.0, 'speed': 510.0, 'type': 'C', 'isMostAccurate': True, 'note': '', 'levelOfData': 0, 'enlilList': [{'modelCompletionTime': '2016-04-24T15:12Z', 'au': 2.0, 'estimatedShockArrivalTime': None, 'estimatedDuration': None, 'rmin_re': None, 'kp_18': None, 'kp_90': None, 'kp_135': None, 'kp_180': None, 'isEarthGB': False, 'impactList': None, 'cmeIDs': ['2016-04-24T04:24:00-CME-001']}]}, {'time21_5': '2016-04-24T09:57Z', 'latitude': 12.0, 'longitude': 115.0, 'halfAngle': 39.0, 'speed': 601.0, 'type': 'C', 'isMostAccurate': False, 'note': '', 'levelOfData': 0, 'enlilList': None}]",0,This CME is associated with a back sided eruption in the north east visible in EUVI 195 around 02:15.,SWRC_CATALOG
640,2016-04-24T14:00:00-CME-001,2016-04-24 14:00:00,,,"['SOHO: LASCO/C2', 'SOHO: LASCO/C3', 'STEREO A: SECCHI/COR2']","[{'time21_5': '2016-04-25T06:54Z', 'latitude': 43.0, 'longitude': 121.0, 'halfAngle': 40.0, 'speed': 231.0, 'type': 'S', 'isMostAccurate': True, 'note': '', 'levelOfData': 0, 'enlilList': None}, {'time21_5': '2016-04-26T02:03Z', 'latitude': 74.0, 'longitude': 116.0, 'halfAngle': 27.0, 'speed': 110.0, 'type': 'S', 'isMostAccurate': False, 'note': 'Latitude is not as far north as this measurement suggests.  Could not get good correlation with STA Cor2 coronagraph imagery, so this was measured using only SOHO C2 imagery.', 'levelOfData': 0, 'enlilList': None}]",0,Source is active region in NE of STA EUVI imagery.  Start time is an estimate as the CME began while there was still significant outflow from the previous 2016-04-24T04:24Z CME from the same source.,SWRC_CATALOG
641,2016-04-24T23:36:00-CME-001,2016-04-24 23:36:00,"[20, 60]",,"['SOHO: LASCO/C2', 'SOHO: LASCO/C3', 'STEREO A: SECCHI/COR2']","[{'time21_5': '2016-04-25T07:10Z', 'latitude': 7.0, 'longitude': -163.0, 'halfAngle': 45.0, 'speed': 276.0, 'type': 'S', 'isMostAccurate': True, 'note': '', 'levelOfData': 1, 'enlilList': [{'modelCompletionTime': '2016-04-25T14:58Z', 'au': 2.0, 'estimatedShockArrivalTime': None, 'estimatedDuration': None, 'rmin_re': None, 'kp_18': None, 'kp_90': None, 'kp_135': None, 'kp_180': None, 'isEarthGB': False, 'impactList': [{'isGlancingBlow': False, 'location': 'STEREO A', 'arrivalTime': '2016-04-27T18:07Z'}, {'isGlancingBlow': True, 'location': 'Spitzer', 'arrivalTime': '2016-04-28T16:00Z'}], 'cmeIDs': ['2016-04-24T23:36:00-CME-001', '2016-04-25T05:12:00-CME-001']}, {'modelCompletionTime': '2016-04-25T15:08Z', 'au': 5.5, 'estimatedShockArrivalTime': None, 'estimatedDuration': None, 'rmin_re': None, 'kp_18': None, 'kp_90': None, 'kp_135': None, 'kp_180': None, 'isEarthGB': False, 'impactList': [{'isGlancingBlow': False, 'location': 'STEREO A', 'arrivalTime': '2016-04-27T17:38Z'}], 'cmeIDs': ['2016-04-24T23:36:00-CME-001', '2016-04-25T05:12:00-CME-001']}]}]",1,CME is a full halo from AR on the far side seen from STA EUVI.  Longitude has been taken as the longitude from the spacecraft.,SWRC_CATALOG
642,2016-04-25T05:12:00-CME-001,2016-04-25 05:12:00,"[20, 60]",,"['SOHO: LASCO/C2', 'SOHO: LASCO/C3', 'STEREO A: SECCHI/COR2']","[{'time21_5': '2016-04-25T09:09Z', 'latitude': 5.0, 'longitude': -165.0, 'halfAngle': 45.0, 'speed': 695.0, 'type': 'C', 'isMostAccurate': True, 'note': '', 'levelOfData': 1, 'enlilList': [{'modelCompletionTime': '2016-04-25T14:58Z', 'au': 2.0, 'estimatedShockArrivalTime': None, 'estimatedDuration': None, 'rmin_re': None, 'kp_18': None, 'kp_90': None, 'kp_135': None, 'kp_180': None, 'isEarthGB': False, 'impactList': [{'isGlancingBlow': False, 'location': 'STEREO A', 'arrivalTime': '2016-04-27T18:07Z'}, {'isGlancingBlow': True, 'location': 'Spitzer', 'arrivalTime': '2016-04-28T16:00Z'}], 'cmeIDs': ['2016-04-24T23:36:00-CME-001', '2016-04-25T05:12:00-CME-001']}, {'modelCompletionTime': '2016-04-25T15:08Z', 'au': 5.5, 'estimatedShockArrivalTime': None, 'estimatedDuration': None, 'rmin_re': None, 'kp_18': None, 'kp_90': None, 'kp_135': None, 'kp_180': None, 'isEarthGB': False, 'impactList': [{'isGlancingBlow': False, 'location': 'STEREO A', 'arrivalTime': '2016-04-27T17:38Z'}], 'cmeIDs': ['2016-04-24T23:36:00-CME-001', '2016-04-25T05:12:00-CME-001']}]}]",1,CME is a full halo from AR on the far side seen from STA EUVI.  This CME is faster than the previous one from the same AR.  Longitude has been taken as the longitude from the spacecraft.,SWRC_CATALOG
643,2016-04-25T14:12:00-CME-001,2016-04-25 14:12:00,,,"['SOHO: LASCO/C2', 'SOHO: LASCO/C3', 'STEREO A: SECCHI/COR2']","[{'time21_5': '2016-04-25T23:02Z', 'latitude': -28.0, 'longitude': None, 'halfAngle': 10.0, 'speed': 450.0, 'type': 'S', 'isMostAccurate': True, 'note': 'POS measurement with STEREO_cat, source unknown, but narrow stream of plasma, CME most likely in the the POS, too high latitude (compared to width), so no impact expected', 'levelOfData': 0, 'enlilList': None}]",0,"source location unknown, nothing visible in neither AIA nor EUVI A.
very narrow, jet-like flow",SWRC_CATALOG
644,2016-04-26T17:48:00-CME-001,2016-04-26 17:48:00,,,"['SOHO: LASCO/C2', 'SOHO: LASCO/C3', 'STEREO A: SECCHI/COR2']","[{'time21_5': '2016-04-27T02:37Z', 'latitude': 31.0, 'longitude': 118.0, 'halfAngle': 10.0, 'speed': 379.0, 'type': 'S', 'isMostAccurate': True, 'note': 'CME measurements were taken using LASCO C3 imagery in swpc_cat.', 'levelOfData': 0, 'enlilList': None}]",0,"Small eruption visible at the NW limb in AIA 193 starting ~17:00 (opening of off-limb field lines), source behind the limb, also visible behind the limb in EUVI A (NE limb). CME was small and very narrow.",SWRC_CATALOG
645,2016-04-27T05:00:00-CME-001,2016-04-27 05:00:00,,,"['SOHO: LASCO/C2', 'SOHO: LASCO/C3', 'STEREO A: SECCHI/COR2']","[{'time21_5': '2016-04-27T12:28Z', 'latitude': 55.0, 'longitude': -102.0, 'halfAngle': 24.0, 'speed': 485.0, 'type': 'S', 'isMostAccurate': True, 'note': 'Although CME source location is at around lon=180 deg, the path of the CME is extremely to the NE (from Earth view) and the CME is not a halo but seems very much in the POS.\nCME parameters were derived from both C3 and STA using SWPC_cat, fitting both simultaneously did not work very well, no longitude could be found that would fit both, preference has been given to C3.', 'levelOfData': 0, 'enlilList': None}]",0,"Former AR 12529 is the source of this CME, EUVI A shows a flare at 04:25 followed by a dimming which moves to the NW of the AR. Although the location of the AR is in the eastern part of the disk (from STA view) the CME in the STA coronagraph is visible in the NW! This CME has a very non-radial path in the lower solar atmosphere. The CME is also visible in LASCO C2/3 to the NE. STA particle data also shows small enhancements at ~05:00.",SWRC_CATALOG
